{
  "id": "provider-zhipu-coding-001",
  "provider": "zhipu",
  "brandGroup": "zhipu",
  "label": "智谱 Token (Coding) Plan",
  "baseUrl": "https://api.z.ai/api/anthropic",
  "apiFormat": "anthropic-messages",
  "apiKeyRef": "",
  "apiKeyVerified": false,
  "enabled": false,
  "status": "unconfigured",
  "accessMode": "coding-plan",
  "services": [
    "chat",
    "reasoning"
  ],
  "codingPlan": {
    "quotas": {},
    "usageTracking": {
      "method": "none",
      "consoleUrl": "https://open.bigmodel.cn/console/overview"
    }
  },
  "tombstones": [
    "glm-5.1",
    "glm-5",
    "glm-4.5-air"
  ],
  "models": [
    {
      "modelName": "glm-5.3",
      "displayName": "GLM-5.3",
      "contextWindow": 1048576,
      "maxOutputTokens": 131072,
      "capabilities": [
        "chat",
        "reasoning",
        "deep_thinking",
        "code",
        "math",
        "multilingual",
        "tool_use",
        "agent",
        "long_context"
      ],
      "serviceType": [
        "chat"
      ],
      "defaultTemperature": 1,
      "defaultTopP": 0.95,
      "description": "智谱 GLM-5.3 大推理模型，面向复杂软件工程与长程 Agent 任务，100 万上下文；强制思考，无法关闭",
      "extra": {
        "thinkingDefault": true,
        "thinkingOnly": true,
        "reasoning": {
          "supportedEfforts": [
            "low",
            "high",
            "max"
          ],
          "defaultEffort": "max"
        },
        "pricingNotes": "国内官方标准价，人民币/百万 tokens；Flash 限时优惠以控制台实际结算为准。"
      },
      "source": "preset"
    },
    {
      "modelName": "glm-5.3-flash",
      "displayName": "GLM-5.3-Flash (Coding)",
      "serviceType": [
        "chat",
        "reasoning",
        "vision"
      ],
      "description": "智谱 GLM-5.3-Flash Coding Plan 版本，原生多模态高效模型，1M 上下文，128K 最大输出，强制开启思考",
      "contextWindow": 1048576,
      "maxOutputTokens": 131072,
      "capabilities": [
        "chat",
        "reasoning",
        "deep_thinking",
        "code",
        "vision",
        "image_understanding",
        "video_understanding",
        "long_context",
        "tool_use",
        "agent",
        "multilingual",
        "fast"
      ],
      "defaultTemperature": 1,
      "defaultTopP": 0.95,
      "extra": {
        "supportsThinking": true,
        "thinkingDefault": true,
        "thinkingOnly": true,
        "reasoning": {
          "supportedEfforts": [
            "low",
            "high",
            "max"
          ],
          "defaultEffort": "max"
        }
      },
      "source": "preset"
    },
    {
      "modelName": "glm-5.2",
      "apiModelId": "glm-5.2[1m]",
      "displayName": "GLM-5.2 (Coding)",
      "serviceType": [
        "chat",
        "reasoning"
      ],
      "description": "智谱 GLM-5.2 Coding Plan 版本，官方最新可用模型，1M 上下文，128K 最大输出",
      "contextWindow": 1000000,
      "maxOutputTokens": 131072,
      "capabilities": [
        "chat",
        "reasoning",
        "code",
        "deep_thinking",
        "long_context",
        "tool_use",
        "agent",
        "math",
        "multilingual"
      ],
      "extra": {
        "codingPlanLongContextModelId": "glm-5.2[1m]",
        "reasoning": {
          "supportedEfforts": [
            "max",
            "xhigh",
            "high",
            "medium",
            "low",
            "minimal",
            "none"
          ],
          "defaultEffort": "max"
        }
      },
      "source": "preset"
    },
    {
      "modelName": "glm-5-turbo",
      "displayName": "GLM-5-Turbo (Coding)",
      "serviceType": [
        "chat",
        "reasoning"
      ],
      "description": "智谱 GLM-5-Turbo Coding Plan 版本，官方可用高阶模型，200K 上下文，128K 最大输出",
      "contextWindow": 200000,
      "maxOutputTokens": 131072,
      "capabilities": [
        "chat",
        "reasoning",
        "code",
        "deep_thinking",
        "long_context",
        "tool_use",
        "agent",
        "math",
        "multilingual",
        "fast"
      ],
      "source": "preset"
    },
    {
      "modelName": "glm-4.7",
      "displayName": "GLM-4.7 (Coding)",
      "serviceType": [
        "chat",
        "reasoning"
      ],
      "description": "智谱 GLM-4.7 Coding Plan 版本，官方可用模型，200K 上下文，128K 最大输出",
      "contextWindow": 200000,
      "maxOutputTokens": 131072,
      "capabilities": [
        "chat",
        "reasoning",
        "code",
        "deep_thinking",
        "long_context",
        "tool_use",
        "agent",
        "multilingual"
      ],
      "source": "preset"
    }
  ]
}
