{
  "id": "provider-cohere-001",
  "provider": "cohere",
  "label": "Cohere",
  "baseUrl": "https://api.cohere.ai/compatibility/v1",
  "apiFormat": "openai-completions",
  "apiKeyRef": "cohere",
  "apiKeyVerified": false,
  "enabled": false,
  "status": "unconfigured",
  "priceCurrency": "USD",
  "services": [
    "chat",
    "embedding",
    "rerank"
  ],
  "models": [
    {
      "modelName": "embed-v5.0-fast",
      "displayName": "Embed 5 Fast",
      "capabilities": [
        "text_embedding",
        "multilingual"
      ],
      "serviceType": [
        "embedding"
      ],
      "description": "Embed 5 Fast；当前 OpenAI 兼容接入仅声明文本向量能力",
      "contextWindow": 128000,
      "extra": {
        "defaultDimension": 2048,
        "pricingNotes": "Token 单价未由当前官方价格页公开确认；Model Vault 按实例计价。 Compatibility API 不接受 dimensions 参数；返回默认维度，多维度选择需原生 Embed API。"
      }
    },
    {
      "modelName": "embed-v5.0-pro",
      "displayName": "Embed 5 Pro",
      "capabilities": [
        "text_embedding",
        "multilingual"
      ],
      "serviceType": [
        "embedding"
      ],
      "description": "Embed 5 Pro；当前 OpenAI 兼容接入仅声明文本向量能力",
      "contextWindow": 128000,
      "extra": {
        "defaultDimension": 2048,
        "pricingNotes": "Token 单价未由当前官方价格页公开确认；Model Vault 按实例计价。 Compatibility API 不接受 dimensions 参数；返回默认维度，多维度选择需原生 Embed API。"
      }
    },
    {
      "modelName": "command-a-plus-05-2026",
      "displayName": "Command A+",
      "capabilities": [
        "chat",
        "reasoning",
        "vision",
        "tool_use",
        "multilingual",
        "long_context"
      ],
      "serviceType": [
        "chat"
      ],
      "description": "Command A+",
      "contextWindow": 128000,
      "maxOutputTokens": 64000,
      "extra": {
        "pricingNotes": "官方文档声明限流额度内免费；生产 Model Vault 按实例单独计价，不预填 token 单价。",
        "reasoning": {
          "supportedEfforts": [
            "none",
            "high"
          ]
        }
      }
    },
    {
      "modelName": "command-a-03-2025",
      "displayName": "Command A",
      "serviceType": [
        "chat"
      ],
      "description": "Cohere Command A 文本模型，256K 上下文，支持 RAG 和工具调用",
      "contextWindow": 256000,
      "maxOutputTokens": 8000,
      "capabilities": [
        "chat",
        "code",
        "tool_use",
        "rag",
        "long_context"
      ],
      "inputPrice": 2.5,
      "outputPrice": 10,
      "defaultTemperature": 0.3,
      "defaultTopP": 0.75,
      "extra": {
        "pricingNotes": "Prices are per 1M tokens."
      }
    },
    {
      "modelName": "command-r7b-12-2024",
      "displayName": "Command R7B",
      "serviceType": [
        "fast"
      ],
      "description": "Cohere 小型高速对话模型，适合高吞吐、低延迟场景",
      "contextWindow": 128000,
      "maxOutputTokens": 4000,
      "capabilities": [
        "chat",
        "reasoning",
        "tool_use",
        "rag",
        "fast"
      ],
      "inputPrice": 0.0375,
      "outputPrice": 0.15,
      "defaultTemperature": 0.3,
      "defaultTopP": 0.75,
      "extra": {
        "pricingNotes": "Prices are per 1M tokens."
      }
    },
    {
      "modelName": "embed-v4.0",
      "displayName": "Embed V4",
      "serviceType": [
        "embedding"
      ],
      "description": "Cohere 最新 Embedding 模型，128K 上下文，多语言支持",
      "contextWindow": 128000,
      "maxOutputTokens": 0,
      "capabilities": [
        "text_embedding",
        "multilingual"
      ],
      "inputPrice": 0.12,
      "outputPrice": 0,
      "extra": {
        "defaultDimension": 1536,
        "pricingNotes": "Embedding models are priced by embedded tokens; price is per 1M tokens. Compatibility API 不接受 dimensions 参数；返回默认维度，多维度选择需原生 Embed API。"
      }
    }
  ],
  "tombstones": [
    "rerank-v3.5"
  ]
}
